utterance_id,speaker_id,utterance,gender
07e0eb9d75,70278,භාවනානුයෝගී පුද්ගලයා විසින්,f
07e14afff3,05d76,මෙම පොදු සංකල්පය රඳා පවතින්නේ කුමක් මත ද,f
07e1a8efd5,b9679,දකුණේ රතිඤ්ඤා පත්තු කරයි,m
07e1c5ab95,ce989,අපි දෙන්නෙක් සහය පළ කළේ,m
07e2155782,f71ec,තල්ලු කරන්න ආයෙ ආයෙත්,f
07e235134d,59778,මේ යුධ මෙහෙයුම්,f
07e272556b,8c558,රතු පැහැයට එක්වේ,f
07e274988c,b9679,ඒ තමයි මරණ දඬුවම,m
07e2d55027,045af,ඒක විතරක් භාවිතා කරලා,f
07e2ee09b1,357e6,උඹ කියන ජාතියෙ එවුන් බලනව,f
07e3932ce8,fe361,සමකල හැකි සුගන්ධයක්,m
07e3bbeeba,0a2fe,මොකක්ද චිත්තානුපස්සනා භාවනාව කියන්නේ,m
07e3e21c5e,60ae5,ඔබ කියන කරන කටයුතුවලින්,m
07e3e2970d,41a77,අද සමාජයේ ප්‍රකටව පවතින,f
07e42455d9,2fff2,අපි දැන් කනවා විතර ම යි,f
07e447644d,8957e,යම් දුකක් විඳිනවාද,m
07e4a561b2,1b014,මේක එකපාර කියන්න පුළුවන් දෙයක් නෙවෙයි,m
07e4c0572a,8b8a4,ඇයි නිශාන්තය කියන්න බැරි,m
07e54f744b,23329,එසේ නොවේ යැයි කීමට,f
07e60ba844,eae99,අමුතුම විදිහේ ෆිල්ම් එකක්,m
07e638beff,206b6,බලන්න මේ පොත,f
07e66acd7a,88c80,මගේ තනිකඩ ජීවිතේ දේශපාලනයට හයියක්,m
07e71662f4,2e076,දත් මදින්න දැන් සෙල්ලම් කළා ඇති,f
07e735390b,30026,කතන්දරයක් ගෙතුවට මක්ක වෙනවද රත්තරනේ,f
07e7cb5785,2e893,කෙලින්ම ළඟා වීමට නොහැකි ය,m
07e7d0089e,bafa0,එනිසාම බොහෝ දෙනෙක්,f
07e7e9000c,8957e,ඒ සෙත් කවියෙන් සෙතක් නොලැබේ,m
07e8da348c,290a8,ඇරිස්ටෝටල් ගේ මේ න්‍යාය,m
07e8e2c1e3,72f9d,දෙදෙනාම,m
07e965c483,cb1fe,මෙලෙස ලෝවැඩ පිණිස හේතු වන,f
07e97c75e7,40e62,අනිත් එක,f
07e9b0dc48,4b127,ඒවයෙ පලවෙන කිසිම දෙයක්,m
07e9b26f1b,dc5ef,වෙලාවකුත් නැති තරම්,f
07ea35c7ca,476be,භාරතයේ හිල්සා ස්තූපයෙන් ලද නිර්මල,f
07ea489a61,646e1,ගණනය කිරීම මගින් දක්නට ලැබෙන ප්‍රශ්නය,f
07ea6e105c,2b212,සිංදුව හැදෙන කොට තියෙන වෙනස,f
07eb1ec6cd,ab81c,එය හරි ක්‍රමයකට,f
07eb25d7b9,e1e01,සියලු කටයුතු සූදානම් කොට තිබේ,f
07eb53504c,bafa0,මේ සුවඳ හැදෙන්නේ,f
07eb5c73f5,96564,දැඩි අසාධාරණයක් සිදුකර ඇති බව,m
07eba40d79,be843,ඇගේ පියා පැවසුවේ ඇය කෙතරම් අධ්‍යාපනයෙන් ඉහළට ගියද,m
07ebd2a7d7,f71ec,මෙම ක්‍රමයට අනුව,f
07eca7cd65,95423,හැකි වනු ඇත,f
07ecb73cb3,a6a62,ඇමෙරිකා එක්සත් ජනපදය සතු සාක්ෂි,m
07ecfe31a8,b06d1,එල්ටීටීඊ ක්‍රියාත්මක කළේය,m
07ed6ee119,361fc,ඔය ගුණවලට අයිතියි රහතන් වහන්සේලා,m
07eda4e5fa,59778,අයියා උපසිරැසි දැම්මා කියන්නෙ,f
07eddefa3a,44e28,ගිහි කෙනක් වෙලා,f
07ee4d8a20,f40d9,එහෙම ඉල්ලගත්තම,m
07ef0de59a,3d705,අම්බලමක් ය කියන්නේ පුරාණ ලංකාවේ පැවති,m
07ef44fc0a,21138,එම දරුවා තේරුම් ගත් ආකාරයයි,m
07ef5cbebc,72337,බුදුහාමුදුරුවෝ දේශනා කරළා තියෙනවා,m
07ef633e51,9094b,එතකොට අර ලෝකෙ දිගම රැවුලා ඉන්නේ,f
07f01a3fc1,cc837,මෙහි සම්පත් ලැබුනායි කියන්නේ,f
07f053097e,f3204,එනමුත් ලබා දුන්,f
07f0da8946,ee9b8,අපි ඔට්ටුවට ගල් ගහපු මල්,m
07f179fcdc,89830,ජනාධිපතිතුමාට දන්වා සිටිති,f
07f273645f,c8454,යුද්ධ කාලයේ දී මොරවක දෙනියාය ආදී ඈත පළාත්වලට ගිහින්,f
07f2f07e62,e1e01,ඒත් සමහර අදහස් නං,f
07f4a33c67,c28da,ධ්‍යාන වඩා සෙසු භාවනා කමටහන් ප්‍රගුණ කිරීමටත්,m
07f4cda41a,a973b,සකසා දී ඇත,m
07f5bb168b,c1691,එකේ තමයි,m
07f5fe7756,8eb5c,කුමන වෛද්‍ය උපකරණයකින්ද සොයාගත්තේ,m
07f6553ff9,92649,නොයෙක් නොයෙක් උත්සාහයන් අසාර්ථක වී ඇත,f
07f673e495,ac562,අතැති මුදලට වටිනා භාණ්ඩය ලබාගත හැකිය,m
07f6d33803,88a58,ඊට මත්තෙන් ඇය,f
07f7a9477a,6996c,ඔහුගේ නීතිරීති වලින් අපි පීඩා වින්දෙමු,m
07f7c4b5fc,8af08,පහසුවෙන් ගැලවිය හැකි උණ ගොබයේත්,m
07f7e39bba,3f57d,අනෙක් කරුණ තමයි වේදිකාව අවදානම්,m
07f8519d64,9094b,එයිනුත් පසුව ඒ තනිකම නැතිවෙන්න,f
07f852d63f,0c839,එහෙම මහා ලොකු දර්ශන තිබුණේ නෑ,m
07f8c8d8a4,a3fac,සෑදු කම්හලේ දී වීම විශේෂත්වයකි,f
07f9406186,d4430,තම කෙස්කලඹ කඩුවෙන් කපා,m
07f94527c3,fda64,එක් එක් පවෙන් වෙන පව් ප්‍රමාණය සැසඳීම,m
07f9e5fd37,ee9b8,මාධ්‍ය අල්ලා ගත් විට වසා දැමිය හැකි යැයි,m
07f9f2b57e,199c3,මුල් යුගයේදී පුස්කොළ පොත් වල,f
07fac07435,8af08,ගැටකපන්නන් හිටියා,m
07fb3c537e,0b586,එහෙත් ඔහු පියවරෙන් පියවර,f
07fb5aea77,74475,සිය ජයග්‍රහණය,f
07fb5e7aeb,0a2fe,දකුණු කොරියාවේ සෝල් අගනුවර,m
07fbe51a68,0bd84,පළවෙනි සින්දුව මං අහන්න කැමතිම,m
07fc2369b8,e9dcb,ඒහෙම බේරිලා ඉන්න අයව,m
07fc25ae54,60906,අද දකුණට යන්නේ අධිවේගී මාර්ගයේ,f
07fc2d81a9,21138,පුද්ගලයා උත්සාහවන්ත වන්නේ නම්,m
07fcc05706,c04d5,එළඹුණ සේක,f
07fd8e280a,97d0a,ඔන්න මම උපසිරසක් අරන් ආවා,m
07fe5cfe61,fb100,වෙන කිකිළියන් නැතුව,f
07feb1bf3c,02578,එහෙත් එවැනි දෙයක යෙදීමට පෙර,f
07ff4c601f,0e1e0,ඔය මිරිස් තුනපහ දානකොට,f
07ff6fdc31,d1c44,එනිසා පිරිමි සතුන් නඩත්තුව,f
07ff7ea7e6,e0b70,කථා කිරීම සල්ලපති,f
07ff82ee49,72337,තමන්ගේ අනාගතය සාක්ෂාත් කර ගැනීමට,m
07ff88ea05,1913e,තම විෂය ධාරාව තුළ,f
07ffba43e9,77895,ඔබේ බුද්ධිය ගැන,m
07ffd2bc18,357e6,එය ලොව වේගවත්ම මගී,f
08003abf94,5dec9,මඟ නො යා යුතු ය,m
08008a3f16,a6493,මට මතක් වුනේ,f
08008dea41,6e92f,ජීවින් ප්‍රමාණය ඔබ දන්නවාද,f
080110712d,64af4,ඔය පැත්තේ,m
080233560c,9e6d1,වෛද්‍ය ඒකකයක් අලුතින් ආරම්භ කිරීම,m
080301d937,023c3,ඔරොත්තු දෙන කෙසෙල් ටික වඳ කරනවා,f
0803467025,54c3a,දැන් පොලිසියට නැත,f
08039b8a72,9a1ed,ආරංචිය ආවෙ,f
08043d978e,6fa50,රංගන ශිල්පිනියක් විදිහට,f
08043e0b4d,40e62,ඉතින් මේ දෙය ඔබට,f
0804474a23,4b1be,ගැටකපන්නන් ඉන්නවා,f
080554d046,3d532,අමු අමුවට,f
0805ca7d84,0e375,කතන්දරකාරයාව සම්බන්ධ කරගන්න,m
08062e1550,4801b,යන්න දන්නෙ නැති නිසා,f
08067c4998,b8a97,අනතුරුව සිංහාසනයේ වාඩිවී සිටි රජු,f
0806827433,a7c07,වෙල්කම් බැක්,m
080699581d,0bd84,අදට ද අපට පාළි භාෂාවෙන් හදාරන්නට ලැබෙන,m
0806c19171,7ab05,කොටස් තුනද සම්පූර්ණ විය යුතුව ඇත,f
0806cdfe3a,a7c07,හඳුනිගේ චරිතයට තෝරාගත්තා,m
0806f5717f,60906,තෑන්ක්ස් සබ් එකට,f
08070bd459,271cb,ඝාතනයට ලක් වූ බව,m
0807430d90,c1715,පුද පූජා වලට ඇත්තේ,m
08079f5ec4,0e1e0,විනය නීති කීප වතාවක් ම වෙනස් කර තිබේ,f
080810d85f,be485,කුඩා යානයක නංවා අභ්‍යාවකාශයට යවනවා,f
080974f96d,781ce,දඹදෙණි කථිකාවත සැකසු දිඹුලාගල මේධංකර නා හිමියෝද,f
08098c837f,02f82,මේ පැවිදි කිරීමේ උත්සව දෙකේ දී,m
0809f69e70,e0b70,විශාල පරිමාණයේ සංවර්ධන ක්‍රියාවලීන්,f
080ae261c7,88c80,බුදුන් වහන්සේගේ රූපය,m
080b1767ba,cf7b2,ඇතිවී නැතිවී යන බැවින්ද වෙනස් වන බැවින්ද අනිත්‍ය වේ,f
080b2676d6,c04d5,උනන්දුවක් දක්වන ඹ්නෑම අයකු,f
080b4a19fe,2f415,මේනකාගේ ගත වෙව්ලන්නට වූයේ,f
080bfba473,d23af,එපා කියන්නේ කොමද,m
080d0bd445,60ae5,එතුමා මට උපදෙස් දුන්නා,m
080d0ce7fb,9f1f5,බළංගොඩ මානවයාට වඩා පැරැණි ඇත්තන්,m
080d139d57,a9c56,හැබැයි හුදෙක් වාරණයට මුවාවෙන්,f
080d66963b,df38e,මෙහි තිබෙන බව,f
080d79ef12,1575e,වක්‍රෝත්තිය කියන එක,f
080d7d3534,15cf5,ලිහා දැමීම ඉතා අසීරු ය,f
080db176db,c8454,අධ්‍යාපනයේ සම අයිතිය නැමැති මානවවාදී දේශපාලන මූළමර්මය,f
080e2ef09d,ed3e5,මගේ පුතා හැම විටම මට කියලා තිබුණා,m
080ee293a5,6064f,කෙනෙක් විය හැක,f
080f162659,7b332,මුදල් වංචාවක් සම්බන්ධ සිද්ධියකට බවද පැවසේ,m
080fc7ccad,6e111,අවශ්‍ය සීයට විසිපහ වෙන් කරල,m
080fcf042c,3062b,කිසිවකු උපන්නේ නම්,m
08106e2c52,76999,හේතු නිසයි මේ පංච නීවරණ ඇතිවෙන්නෙ,m
0810735f40,59778,ඊට ඇති පිළිතුර සුබදායී නොවන බැව් අපි දනිමු,f
08113b6867,e8ec1,පිරිත් පැන් මෙබඳු බලපෑමක් කිරීමට හේතු,m
08121c2724,3139c,උත්තරීතර බව ගෙනහැර පාන්නට යෙදුණාවූ,f
08124db617,0e1e0,උන්වහන්සේ සියලූ තපස් ගුණයන්ගෙනුත් අග්‍ර වුනා,f
081250b7e3,30661,අපි බදුල්ල පාරේ දිගටම යන්න ඕන කුරුවිට හම්බවෙනකන්,f
0812da3a45,0eee9,ඇමෙරිකාවට කිසිසේත් අවැසි නැත,f
0812f214f5,ad58a,නව්සීලන්තෙ ගොම,m
081330a7ae,fd8a1,මේක මං හැදුවේ,m
08134750a0,b06d1,නිවුණු භික්ෂුවට පමණක්,m
08137b59f8,e61f1,ඇස් අන්ධ වූ විට වඩා හොඳින් ඇසෙන බව,f
0813cf22a0,bfb80,හෙන ඉල්ලනවා ඇරෙන්න,f
0814028576,4b215,ප්‍රධාන ගොඩනැගිල්ලට පිවිසෙන,f
081448f498,760be,කරුණාව මෛත්‍රිය දයාව අනුකම්පාව වගේ යහපත් ගතිගුණ,f
081546e57f,b9dc2,බයිස්කෝප් එකෙන්ම මේක බලන්න හිටිය,f
08154bfbc4,7f4b1,හිරවි කරනු ලබන්නක් නොවේ,f
0815ed8443,d23af,තාම බලන්න බැරි වුනා,m
0815f15ca8,f5954,සිංහල ගුරුවරයකු වන උපුල් ශාන්ත සන්නස්ගල,f
081712c3b4,746ff,මෙලෙස වූ සතර අපායෙහි කිසිදු සැපතක් නොමැත,f
08175587c0,d1b3d,උදාරි සැඳැල්ලට ආවේ මේ විදියටයි,f
08190a75bc,f5954,පිරිමි කාණ්ඩෙත් එක්ක වැඩිපුර කතා බහට ආවා,f
08196753fa,c95d0,පත්තර වල,m
08198567fe,2f415,මිය ගියාට පසු,f
0819d6f4af,80862,තම ගමනේ අරමුණු,m
081a2e82d0,12204,ඒවයේ ඇත්ත නැත්ත මටනම්,f
081a93be8a,95997,මේ චිත්‍රපටය සදහා දායක වි තිබෙනවා,f
081ab7b81a,e5259,ඔන්න අන්තිමේදී මෝටර් රිය,f
081b14b6c7,5dec9,අද ලෝකෙම ඉවරයි,m
081b831ef6,ae3ff,එය ආගමික උත්සවයක් බවට පත් විය,m
081bf889bc,2e893,නමුන් එච්චරටම කුහකයි,m
081c33f5a6,43121,දරුවන්ගේ මනසෙ සැරි සරනවා,f
081c3470c8,1b014,එකිනෙකා හැමදේම තම තමන්ට හිතෙන දැනෙන විදියට දැකපුවාවේ,m
081c6feeb8,a973b,එසේ නම් අප කෙසේ ද,m
081ca4c7d1,77895,මම දන්නේ නැත,m
081cf3a31d,3183b,ඒත් ඒ අතරින්,f
081d7d19bf,d6ccd,කාන්තාවන් දෙදෙනෙකු අතර,m
081d8e15f7,29f4f,අපට හිතුමතේ ඒ වගේ,f
081d9121fc,94b34,අන්න එහෙමය,f
081dc18a80,1ccf9,එහෙමත් නැත්නම් කකුලෙන් පොලව හාර හාර ඇඹරෙනවා,m
081dd64525,e8724,හොයා බලන විකියා,m
081e0ef2f1,5b275,අවසන් වීමක් ද තිබෙන්නට ඕන,f
081e387655,0a2fe,ඔවුන් ආරක්ෂා කිරීම අපහසුය යන්නයි,m
081e6e5f07,f0a29,අප දැන් සමත් වී තිබෙනවා,f
081eff848d,ac562,උදවු ලැබෙන්නට ප්‍රථමව ඔහුන්ට,m
081f577564,c3bd0,අඩුපාඩු හොයන්න,f
08201d2087,b8a97,නොසැලකිය හැකි තරම් අවම මට්ටමක පවතී,f
0820c4ebd4,a6a62,ස්ථානවල තිබෙන පුවරු,m
0821977ee7,f8790,මේ පිළිබඳ ඕනෑ තරම් උදාහරණ,m
0821c78dd5,290a8,අවුරුදුවලට ගෙදර එන්න බැරිවෙයි කියාල කිව්වා,m
0821cad208,77b4b,එමෙන්ම ටෙස්ට් කන්ඩායමේ,f
0822422fdd,c26ed,කොටස් හිමියන්ට ප්‍රතිලාභ දෙන,f
0822429209,ac562,ඉතින් එයාගේ පහුගිය පැටිකිරියෙන් මනින්න බැහැ,m
0822f13998,f32c3,කියල නිකමටවත් හිතුන්නැහැ,f
08231ef544,58355,පුද්ගලයා ආසාවෙන් සමීප කර ගන්නා සියලු දෙය තුළම,m
0823a89c4d,0e86b,ඛේදජනක ඉරණමකට,f
082477e224,4801b,ඓශ්චර්යමත් සිරුරකි,f
08247af174,9f1f5,අන්න ඒ ආර්ය සත්‍යය අවබෝධ කරගැනීම තමයි,m
0825178fc8,b7510,යනුවෙන්ද එහිමියෝ පැවසූහ,m
082525f186,33901,ආගම්වාදයේ නිස්සාර ධජය යටතේය,f
082546a0bc,4a53b,මෙම මිනිස් ලෝකය වැනි,m
082630d3db,589b0,මතුවන විට නිලධාරින් කෙරෙහි,m
082634253d,7f4b1,සිදුහත් කුමරු ඉන්දියානුවෙක් වන්නේ කෙසේද,f
082649325e,78366,ඔබ දන්නවද එංගලන්තෙ වේල්ස්,m
0826731a64,3d027,දැන් පොත් කියවන්න පටන් අරගෙන,f
0826af99a6,8af08,ඒ සින්දුවත් ඉවරයි,m
0827f92f8e,349a2,හිත එත්නම් පත කුඩා නැත්නම්,f
08282f0a37,91589,ඔක්කොම අවුල් පටන් ගන්නේ,m
082837177d,be2e9,නමුත් මේ සියල්ල දෙස අප බැලිය යුත්තේ,f
0828804ede,a9c56,එය ඔහුට පමණක් ගැටලූවක්ව තිබූවක්,f
0829347c0f,e9dcb,දහ අට කුළයක ජනතාවද රට පුරා පැතිරී ගිය බවට සැකයක් නැත,m
082963d841,12204,මහායාන බෞද්ධයන් බුද්ධ ශරීරය ලෙස පිළිගත්තේ ධර්මය යි,f
082a89f866,a13a8,අලුත් ජීවිතයක් පටන් ගන්න,m
082a9c6657,ed0c5,එය නුතන ප්‍රේමවන්තයන්ට ද මහඟු ආදර්ශයක් වනු නොඅනුමාන ය,m
082b09c2bc,b8a97,සටහන් වී තිබෙන්නේ,f
082ba19555,54242,මේ නිසා සිය ආර්ථිකය සැලසුම් කරගත යුත්තේ,f
082bc923ec,43121,රහතන් වහන්සේ නමකට දානය වළක්වාලීමේ පාපය හේතුවෙන්,f
082c19f2d7,c696a,නිරුවත් කලාකරුවන් දකින්නට හැකිවීමයි,m
082c455697,17bfd,අද නම් පෞද්ගලික ජීවිතේ සහ රාජකාරී ජීවිතේ,f
082c8214a0,75985,සුනිල් විමල් එක්ක ඉන්න එක නිසා මිසක්,m
082caee2a0,dc5ef,ඉහත ලිපියට ලැබී ඇති මුල් ප්‍රතිචාර දෙක මෙසේය,f
082cd84025,6c5e8,උංගී නිදා හුන් ඇතුළු කාමරයට වැදුනහ,m
082d93af80,ae3ff,නැවැත නිසිමඟට පැමිණීමේ හැකියාව,m
082d9fce2b,db538,සිත පිරිසිදු වෙනවා,f
082e0274f8,b6388,උගේ ජීවන පැවැත්මට,m
082e67178f,84afe,හරි ඇමතියෙක් දාන්න ඕනේ නැහැ,f
082ee130db,34e11,යම් කිසි ක්‍රියාවක් එහි සම්පූර්ණ මාර්ගයම ගෙන ඇතැයි,f
082ef65fd2,1a317,පිට වුණේ නැහැ,m
082f50a05f,4b1d7,සාහිත්‍යයේ නිරූපණය කොට ඇත,m
082f598a5b,b06d1,පෙරටුගාමින් සතුවන අතර,m
082fb4f1d1,25717,නුඹ ගලිවරයෙක්මැයි,m
0830255a09,2df96,මෝඩ ක්‍රියා අනුමත කරන්නේ නෑලු,f
083107eda7,91fdf,මෙහේ අශෝක හිටියේ ඉන්දියාවේ,f
0831b13001,72337,ඔහුට පසක් විය,m
0831e5aa36,23e9e,ලේසි වැඩක්ද එහෙම කරලත්,f
0832c1055e,44978,පුරෝහිත බමුණන් කීවේ,m
08334df527,41947,අපේ රටේ මිනිස්සුන්ගේ දහඩිය මහන්සියෙන්,m
0833a07f62,91403,මෙලෙසින් දසපාරමිතා සම්පූර්ණ කිරීමෙන්,m
0834c1bb00,fe361,නිකංවෙනී ගන්නෝරුවෙ ගියා මාත්,m
0835904b27,c6f6b,ඇයත් කීවා අනේ ගහන්න එපා,f
0835ad9db8,47746,එය පරලොව ගිය අය කෙරෙහි,f
0835c4ff12,41a77,ඉතිං කියන්න ඕන,f
0835e1bd38,92637,අත තියලා සෙත් පැතුවා,f
08362f70f6,dabc0,අපගේම ජීවිතයටත් සමාජයටත් ලෝකයටත්,m
083683752f,9f1f5,මම ඇගේ කඳුළු අතරින් ම එය අමුණමි,m
0836ac492b,c6a4f,සිංහර රජුට විරුද්දව සටන් කල යුතු විය,f
08375425ad,b7510,තිලක් නම්බුකාර විදියට හිටපු ගොවියන්ට,m
083906843f,3062b,ජයන්තයට සිහ ශක්තියෙන් වැඩ අඩුවෙනකොට,m
08392c0b3b,589b0,එය චිත්‍රපටය නොදුටු අයගේ,m
08393fbf62,b0095,භාග්‍යවතුන් වහන්සේ කෙරෙහි,m
08397c94ca,c6f6b,ඊට වඩා ගොඩක් පුළුල් පරාසෙක විහිදෙන,f
0839938241,f32c3,ඔය සමහරක් අය ඉන්නේ,f
0839aaef8e,f2348,ආදායම් තත්ත්වයේ උසස් වර්ධනයක් පෙන්නුම් කරන අතර,m
083a062262,9a1ed,එහි මානසික බලපෑම,f
083af700d5,a3fac,එක්සත් ජාතික පක්ෂය,f
083b089909,ec9a8,මෙවැනි අර්බුදකාරී තත්ත්ව මතු වෙනවා,f
083b33c3d1,abbea,උපක්‍රම භාවිතා කළොත්,m
083ba643db,c95d0,එය සතුටේ මූලධර්මය,m
083bc533a9,1a1f3,වික්ටර් ඔහු වෙනුවෙන් නොමිලේ සංගීත ප්‍රසංගද පැවැත්වීය,m
083c9d9a5a,1c3b9,මේක සජීවීකරණ හාස්‍ය චිත්‍රපටයක් ගැන ආරංචියක්,m
083d902f68,9a1ed,එය නැතිකර ගත්තේ,f
083daf798b,d78dd,හිතාගෙන ඉන්නේ නකල්ස් මීමුරේ,m
083e426ab9,8b8a4,ඒක අහල,m
083e66d299,0e86b,මෙසේ දුර් වර්ණ වූ චිත්‍රයකි,f
08406681c3,778ef,හැමදේම අත්ඇරලා,m
0840ba1af2,ee3d2,සුගතිගාමි වීම ශීලය තුලින්,m
0840c29b39,ee9b8,අපි ජනතාව කියන එක,m
0840f55425,f40d9,හීන් බළල් සද්දෙකින් හිනා වෙන්න,m
084121582f,97d0a,ඇත්තමට මේ අතරෙ වන සිදුවීම් දාමයන් අතර,m
08417275f3,4b05c,අවස්ථා ලබා දී තිබෙනවා,m
0841787294,47746,අතුරුදහං වෙන්න හේතුව පැහැදිලිවම කියල තියෙන්නෙ,f
0841fa596e,a624d,එය ඔහු ලෝකයාට කරන විශාල යහපතක්,m
08422df791,58355,ධ්‍රැවයන් හි අයිස්,m
0842952b4f,dc1f3,තවමත් තහනම් කොට නැත,m
0842b4c4a0,231ca,මූට එහෙම කරලා නිවන් දැක්කයි කියල තියෙනවද,m
0842db9fdd,ee9b8,චිත්‍රපටය රසවිඳින ලෙස ඉල්ලනවා,m
08433e86db,84048,සැදැහැති බෞද්ධයන් බවට පත්විය හැකිය,m
08433ec149,91589,ගබ්සා කිරීම වැළැක්විය යුතු අතර,m
08438b518e,5d099,ඊළඟ අවුරුද්දේ රැග් කරන්න අවසර නැති වීම විතරයි,m
0843a8bf92,746ff,වෙන මොකද්ද,f
0843b441b2,60906,ස්තුතියි සමිර සහෝ ජය වේවා,f
0844ad7225,c2201,නන්දෝපනන්ද නාග රාජයා ද,m
0844afb347,fb100,එක කවුරුත් දන්නා දෙයක්,f
