utterance_id,speaker_id,utterance,gender
0432293486,0e353,වැඩි ඈතක නැති බවනම් පේනවා,m
043249daa3,0eea5,එතරම්ම ලස්සන අප්සරාවන් මේ ලෝකේ ඉන්නවාද,f
043327cd91,356c8,නගින්න මම ගිහිං දාන්නං,m
04339afeb4,2df96,ඒකෙ ගල්,f
0433e6a09c,781cf,ගුණවර්ධන මහතා,m
0433ff3f2d,5556c,ඇහුවාම මෙන්න,f
04348077af,b3777,නිර්දය ලෙස විවේචනය කරමින්,m
0435d3eed3,4a724,උන්වහන්සේගේ හැරමිටියේ එක කොනක්,f
0435e12749,54c3a,අපි දෙන්නම දැනගෙන හිටියා,f
04365e9fad,a5886,බුදුරජාණන් වහන්සේ අවධාරණය කරන්නේ,m
043695075d,dca20,යුද්ද කරන්නට වන්නේ,m
0436b64b03,dc1f3,පිළිකුල් සහගත නැද්ද,m
043889eb16,84048,පොදුවේ සලකා බැලූ විට,m
0438a8ec49,a360d,අද මට මෙවැනි හානියක් වෙන්නේ නෑ,m
043a071212,024f4,මේ ආරෝග්‍ය ශාලාවල ලෙඩුන්,m
043a5423e6,252fd,මුගේ හිතේ ඒ කියලා තියෙන්නේ තවත් මනුෂ්‍ය වාස ග්‍රහ ලෝකයක් ගැන කියල වෙන්න ඇති,f
043ad00eb2,3e0de,අපේ ලංකාවෙ ගායක ගායිකාවො ගයන බොහොමයක් ගීත,f
043b1345c2,8f885,ගොඩක් කාලෙකට පස්සේ,m
043b85b41d,d0123,ගීතයක් ගායනා කරනකොට,f
043ba58b78,d23af,ඔය කොයිකත්,m
043ba5e27b,4b5d0,එදා සිට සමන්ත කූට මස්තකයේ පිහිටි,m
043c4088e1,eae99,අපිට මොකෑ බොලන් ඕක,m
043c7eae21,43121,අද කාන්තාවන් විලාසිතා කරන්නේ,f
043ca760f6,e9148,අනික මොකද්ද මෙකේ තියෙන වැරැද්ද,m
043cc3d123,ed4c3,එන්න අපි දෙන්නා හාල්පාරු සංගමයක් හදමු,f
043ccb4975,c5b76,භික්ෂූන් වහන්සේ එය පිළිගත්තේ නැති නිසා,m
043e93355c,c26e2,පත් වී ඇත,f
043ec077e7,f32c3,සිංහල බෞද්ධයන් විසින් පිහිටුවා,f
043efad1dc,8827b,ඌත් අපේ එකෙක් කියලා කියන්න,f
043f0c6712,e8724,සිදු විය යුත්තකි,m
043f16ca4e,a7708,එම මොහොතේ ම,m
043fd0ee9e,e61f1,මෙසේ සියලු සත්වයන්ටම,f
043ffe05c8,d1c44,එයත් අනිත් ජොබ් වගේම,f
04406dd41c,e61f1,එතකොට තමයි අපට මහා සැපයක් ලබා ගැනීමට පුළුවන් වන්නේ,f
0440911f9d,a3fac,ඒ ගංජා බොමින් දිරාපත්ව සිටින,f
04414edec7,016b5,ඒ සෝලංග ආරච්චිගේ පවුල,f
0441504599,34e11,එයා හොඳ ගෑනු කෙනෙක්,f
04418f1910,54242,ඒක නිසා මුන්ට දැන්,f
0441bbe136,016b5,මෝඩ විදිහටනේඒකයි මේ,f
0441eb5960,cf7b2,මාම්පූරිය ගම්මානයේ පදිංචිකරුවන් බව,f
04420f5739,32337,බොහෝ අය,m
04424c2205,41a77,කිරි නොගන්නා බවට ගණන් බලා ඇත,f
04426cf94b,9e6d1,එහිදී සියයට අනූඅටක්ම,m
0442bdad3a,7599b,මට ආදරය කළා කියලා,m
044354e924,c4922,ලියපු කවි පොතක් තිබුන මහ ගෙදර තියල,m
04453ede50,6064f,අපි කාටවත් මඟහැරලා යන්න බෑ,f
044540230d,2df96,එම ථෙරාපදානයන්හි අවණ්ටඵලදායක වර්ගයෙහි,f
0445962c06,c1715,බිතු සිතුවම් නිර්මාණයට,m
04466b001a,f2348,ඇති ව්‍යුහය සම්බන්ධයෙන්,m
0446cc6e2c,29f4f,ඔය කියන බෙහෙත,f
0447674dcb,f32c3,ඔක්තෝබර් නොවැම්බර් කාලය තුළ,f
0447c900f4,bc55f,අධිකරණය සිය තීන්දුවෙන් ප්‍රකාශ කර සිටියේ,f
0447d48ddc,ee066,නොවේද ඔබ රෝගී වුයේ,m
0447e38a50,8b8a4,රක්ෂිත බන්ධනාගාර ගත කරන ලදී,m
04484b9a41,5b471,ආනන්ද තෙරුන් වහන්සේ,m
0448900506,d2f72,මෙවැනි පාර්සල් ලැබී ඇති බව පැවසෙනවා,m
044924a1df,d94a9,ක්ෂේත්‍රයේ ජනතාව,m
04497b0c5c,4801b,මෙහි ඇති බෞද්ධ සිතුවම්,f
0449ba24ff,03500,උද්ගතව තිබිමය,m
0449cb510c,c696a,එයා වැඩ ඇරිල එද්දි,m
0449f46a9d,bac38,බහුජාතික කොම්පැනියක්,f
0449f9a1fd,d1c44,මහ මෝඩ වැඩක්,f
044a7c9491,89130,අපි දන්නව,f
044afcd12c,06105,අයින් වෙන්න හේතුව,f
044ba7aca6,c04d5,මේ රැග් එක නිසා තමයි,f
044bdb9c4c,8eb5c,සිංහල අනියමාර්ථයක් ගැන,m
044c08186c,30661,පෝස්ට් එකක් නොලිවිය යුත්තේ කෙසේද කියන,f
044ca585c6,7f4b1,ගමනේදි ආටානාටිය පිරිත ඇසුරෙන්,f
044cf7c8f8,00349,ඒ ගැන පැතිරී තුබූ ගෞරවයද,m
044d1e0ba5,c1715,ඉස්සරහට ලෝකේ මිනිස්සු අපිට වඩා ගොඩක් දැනුමින් සන්නද්ධ,m
044d283473,0eade,මෙම නම් අතර දැක්වෙන,m
044d882728,54242,සිංහල සබ් වලට ස්තූතියි,f
044e24099f,271cb,ඉතින් මේ මල්ල අරගෙන,m
044e9283ad,ac581,මේ නිසා ලොව දීර්ඝතම,f
044eabc11a,8af52,නැතිනම් මරණය නියතයි,f
044ee7f8a2,1c3b9,සිතේ පැවති කරදරයකින්,m
044ef23163,1afa7,මහ පොළොව මෙන්,m
044f49645d,d7f61,යක්ෂණිය බයෙන් බයෙන් බොහෝ තැති අරගෙන,f
044f54149d,d9b9c,ඔහු කුමක් කියාවිද,f
044f6fef0e,3be3a,මොකෝ අතීතය කුමක්ද,m
044fa6799b,e5fb8,මහායානිකයන්ට අනුව,m
045041a746,be341,ශිෂ්ටාචාරවලින් දක්නට ලැබෙන්නේ ඒ පුරාවස්තුයි,m
04504dde69,cf7b2,මහ පොළොවේ කිමිදී,f
0450da9371,2f415,ආජන්ටිනාවේ ඉපිද කියුබානුවන් වෙනුවෙන්,f
0451294951,3489d,ඒ කිව්වේ තව විනාඩියකින් විතර,m
04518343a0,4a724,දෙවනුව දෙන ධර්ම උපදේශය,f
0451d1f05f,92649,ජනමාධ්‍ය හරහා ජනතාව අතරට,f
0451e70d9a,bc55f,ඉතිං ඒව හැම තැනම එක එක විදියට එක එක කතා පැතිරුණා,f
0452a4f896,dabc0,එමගින් සනීප වීමේදී,m
0452c3824f,3139c,එහි පුදුම කෘතීම ගතියක් තිබුනා,f
0452d72931,e47dc,එක්තරා හිමිනමක් හා පන්සලක් තමයි මේ ගැටුමට මුල් වුණේ,m
045377c4b2,e0b70,මාලිගාවට පූජා කරවන ලද,f
04542854a9,e0b70,ඔවුන් කෙරෙහි පරණ මතකය තියාගෙන,f
045450a686,c3bd0,අපි ඒ ඇසුරෙන් තේරුම් ගන්න ඕන,f
0454649dec,8f885,අයියා දාලා තිබ්බ ලිස්ට් එකේ,m
045528d539,ee066,ප්‍රමුඛස්ථානයෙහිලා සලකා ඇත්තේ,m
0455696e50,98088,උත්සාහකෙරුවේ,f
0455c406e4,fb100,ජීවිතය වෙනස් වීමේ හැකියාවන් මතය,f
0456875531,52af9,ගිවිසුමට සම්පූර්ණ විරුද්ධව,f
04569aefb7,a0028,දළදා වහන්සේ භාරව සිටි කෙනෙකුට,m
0457025fb9,7d7d0,සිත පිහිටුවන්න කියලා,f
045754a0aa,663e8,වඩාත් අමාරුයි වගේ,f
0457bdb951,fc710,මා භාර ගන්නෙ නෑ,f
04586c82f8,af4ca,එයි යටි පැත්ත,f
0459707d5e,41a77,එය සිය සිරුර් සැගවුණු,f
045afca31d,02578,ඔබ අවබෝධ කරගන්නවා,f
045afcb983,1db0f,එතකං මේ ගෙදරට වෙලා,f
045b7ea405,357e6,හටගන්නා බව පෙන්වා දී ඇත,f
045bf9d829,6dcd3,පොඩි සහයෝගයක් දෙන්න,f
045cca14ab,40381,මුහුණදීමට සිදු වුණේ නැහැ,m
045cd24bee,0bd84,බ්‍රාහ්මණයෙනි,m
045ce549f5,c5a59,උඩගුවූයේ නැත,m
045d080203,5556c,මඟුල් බෙර වාදනය පවත්වයි,f
045e65b51a,78366,මගේ අඩුපාඩු මොනවා හරි තියෙනවනම් ඒවා පෙන්නලා දෙන්න,m
045ea3a183,41947,විවිධ ආකාරයකට හසුරුවා යා හැකියි,m
045f3fe9ea,e9dcb,නිරවුල් කර ගැනීමට හැකි වේ,m
046025d2d0,202fc,අකිල ඒ ළමයටත් කිව්වා,m
046082c723,349a2,එත් අපහු එන්නේ නම් නැහැ,f
0460ba02ef,9e6d1,මගේ අදහස් දැක්වීම,m
0461aedd4b,2bdfd,දේශපාලනය විසින්,m
0461c452f3,93c65,මෙය නිර්මාණය කර තිබෙනවා,m
046238cf50,dabc0,ඉතින් තවත් බලන් නොයිද,m
0462d110a1,4b1d7,ඔය කියන එව්වාගේ,m
046354cccb,346c1,ලෝකයේ ජනමාධ්‍ය මොන තරම් උනන්දුවකින් පසුවිණි දැයි පැහැදිලිය,f
04638199ce,ee9b8,අම්මාට පිං දෙන්නේ නුහුගුණේ අයියාය,m
046460ba29,023c3,එම විනාශ වූ දේවල් ගොඩනැගීම ගැන,f
0464a26ef0,77b4b,වෙන්නේ සබ් කරන එක එපා වෙන එක,f
04658f4059,52af9,ගමන් කරයි,f
0465c08dad,3be3a,අද ඔප්පු වෙලා ඉවරයි,m
046619295c,a3fac,මේ වගේ දේවල් සිද්ධ වෙනවා,f
04662932bb,73ec9,ලෞකික පාරේම දිගටම යති,f
0466636f50,a3d94,සැබවින්ම මෙය එපමණ මිහිරි වියමනක් බව,m
04670ae5b3,0a38f,කොයි මොහොතේ පිළිස්සී යාවිද,f
0467551826,284b7,උඹ මනුෂ්‍යයන් විනාශ කරන්න ආපු අමනුෂ්‍යයෙක්,m
0467e98775,8c558,සිංහල බෞද්ධයන්ගේ අයිතිය,f
0469297dfe,663e8,ස්වභාවික ලෝකයේ ලක්ෂණයකි,f
0469f1338a,d6ccd,එතැනට යාම,m
046a16f936,a624d,යම් කිසි කෙනෙක් නිවන් අවබෝධ කරන්නට කැමැත්තෙන්,m
046ac1e569,0b370,කෝ කතන්දරේ කියලා,m
046c213f12,3386d,ඒත් ඉතින්,f
046c7b6a2d,b136f,මේවා ඇතිකරන සන්නි යකා,f
046c9e4ec3,d4fa9,අපේ ජාතීහු,f
046cbc6acb,babec,දොළොස් වියැති පුතු දියණිය සහ බිරිද,m
046ce6d492,284b7,ඒක තමයි බං,m
046d823688,60906,පුද්ගල ගැටුම් බවට පත් නො කර ගත යුතුයි,f
046dd131b6,912d1,අද සිය ජීවිතයෙන් සමු ගන්නා විට,f
046de5d05d,23e9e,එත් පොඩි ඉඟියක් දෙකක් තිබුනා,f
046e9b684b,0622a,ඔය ආදරේ නිසානෙ,f
046ee4e97a,2db87,හිටපු පොත්ගුල්ලා නෙවෙයි දැන්,m
046f059bbe,a3fac,මේ තුළින් රටපුරා බෞද්ධ ප්‍රබෝධයක් ඇතිවේවායි පතමි,f
046f928142,0224d,එම අවස්ථාවේ මාතර පොලිසියේ නිලධාරින් පිරිසක් පැමිණ,m
046fd22f7b,df38e,එසේ නම් කවුරැන් හෝ,f
04710b4fcd,89830,උතුරු කුරුකියන්නේ එක්සත් රාජධානිය වෙන්න බැරිද,f
04714f976c,23e9e,නෝනට මට වලි දාන්න බැරි වීම,f
0471509793,97d0a,පොරොන්දුවක් ලැබුන වෙන්නත් පුළුවන්,m
0471516d5d,225dc,රෙදි කෑල්ලක් දුන්නා,m
0471a08ea4,f0098,උන් වහන්සේ මේ රට රකින්න හැදුවෙ තොපි වෙනුවෙන්,m
04720b71b0,760be,විශේෂ පලක් නොමැති අතර,f
04722807c1,dff99,දැන් එක එක ජාතියෙ සමාපත්ති පහළ කරගෙන,f
04728cf1a3,cc837,දූ දරුවන්ගේ අභිවෘද්ධියට,f
0472cc7723,d94a9,මොන පාසලේ ද ඔබ සේවය කරන්නේ,m
0473619caf,937dc,අපේ හිරු මෙන් මිලියන ගුණයක්,f
0473d9d2f9,b8589,මේ කතාව නැරඹුවායින් පස්සෙ,f
0473e9baf1,3fcd4,පතුරු ගැලැවී විනාශ වී තිබේ,f
047410211e,5556c,ඒකට අනුව,f
04744fae3d,06105,ඉන් හරියටම වසර කට පසුයි,f
04759a1165,237d4,රටේ ජනමාධ්‍ය මේ විදිහට බොරු ලියනකොට,f
04761e9e40,a7708,භාරගන්න බව ප්‍රකාශ කිරීමයි,m
04762b85a8,ff39f,අපි හැඟුම්වලට ඉඩ දී මොහොතක්,f
0476611761,ff39f,නිදහස අගයන පරිදිය,f
0476620efa,15e2b,ඇය දැනගෙන හිටියා,m
0476c4146d,91403,මුගලන් හිමියෝ ද ඒවා මැඩ,m
04771164ad,be173,එහෙම පැනලා,f
04777b2289,db538,සිංහල බෞද්ධයෙනි අපට මගක් තියෙනවා,f
04783a4e84,3139c,ඔන්න දැං ඒකට චාන්ස් එක ඇවිල්ල,f
04784ada45,91fdf,ඔබට බුදු සරණයි ප්‍රවීන් මැනිලා,f
04786563b3,68b8a,තම ශිල්ප ඥානය වැඩිදියුණු කරගෙන ඇති,m
04788c9a2f,92649,ඇතිවෙන දේ,f
0478f56c03,f3efc,ඒ වගේම අපි,f
047905417e,b0095,වෙන එකක් අඳින්න,m
0479ae1b7b,9125c,ලෝංහස්ට් වැනි පුරා විද්‍යාඥයෝ ප්‍රධාන තැනක් ගනිති,f
047a59fd8c,34e56,අලුත් සැමී කතාව නිමා කළේ,m
047a5a1e9f,11742,මේ විදිහටම හක්ගෙඩියක පාටට හැරෙනවා,m
047ab23fc9,a360d,ඔබලා ආනන්දයන් උනන්දු කළයුතු නැහැ,m
047cf0d7a9,bba51,ඉතාම සිම්පල් කේස් එකක්,m
047d145df5,f71ec,යුද්ධයට එරෙහිව ගෙනගිය,f
047d67d29d,d1c44,එය සිය සිරුර් සැගවුණු,f
047de34d15,fea0e,බහලුම් නිදහස් කිරීමට,m
047ded6182,0eea5,නැතිව ඉන්නලු,f
047e3ee289,47746,ඒවාට විසඳුම් ද පවතින අතර,f
047e4f5d9a,9d5b3,ඒ කොස්තාපල් එහෙම කරන එක,f
047e8c4053,338ff,මොකද ඉන්දියානු ආණ්ඩුව ජිනීවාවලදී දුන් පණිවිඩය,m
047ed15185,5d099,බොහෝ භික්ෂුහු උන්වහන්සේට ගෞරව දැක්වීමට පැමිණියද,m
047f09e9e1,f32c3,මොනවා හරි ඉගෙන ගන්න,f
047f6ec062,ee9b8,වෙසක් පහන් කූඩු වලින්,m
047fd77226,fea0e,එසේ නො වන නිර්මාණ නොකියවා,m
048055d53b,29f4f,ජාතික යුතුකමක් ඉටු වීමක්ද සිදුවේ,f
04809a5962,52af9,අපේ රටේ ඉතිහාසය ගැන ආඩම්බරයි,f
0480a83902,8fa6b,විද්වත්හු සළකති,f
0480b5df92,be341,කුරුණෑගල ඉබ්බාගමුව අරංකැලේ වනවාසාරාම කුටිය,m
048180711d,d4fa9,පාලනය කරන්නේත්,f
0481bce843,92649,ධර්මය නැති කාලයි,f
0481e46bd5,34e11,පස්ස දොරින් ගහනවා වගේ පනතක්,f
048203a1ca,f3f41,බුදුරජාණන් වහන්සේගේ ලංකා ගමනයත්,f
04825affba,3bfb3,අනිත් ගැටළුව තමයි මාසෙකට,f
0482782b37,7ec98,හැබැයි අපි නම් වෛද්‍යවරයෙක් ළඟට යන්නෙ,f
0482e85063,ae3ff,එළම තමා මේකට,m
048394d05b,8e991,දක්නට ලැබේ,m
0483e9bcc9,34e11,අපි අනිකාගේ සතුටෙදි,f
0483f9516f,cd0b3,අපේ පාක්ෂිකයින් දැන් දුක්වින්දා හොඳටම ඇති,m
0484007551,f9563,ආර්ථික අපහසුතාද මතුවිය හැකි අතර,m
04841bd94c,7599b,කිව්වේ ඒක,m
04841f63f2,51515,මේ වසරේ මුල් මාස තුන,m
0484b1fd7c,023c3,නොමඟ යැවීමට හෝ නරක ආදර්ශයක් සැපයීමට,f
0484f0b67d,5afae,වැඩිමල් ගෑනු ළමයෙක් ඉන්නවා මිෂෙල් රානි මුඛර්ජී කියලා,f
0484f3e01f,2bdfd,මෙම චිත්‍රපටය විසින් දිනාගනු ලැබූ,m
0485505c5a,3183b,ලොව මෙතෙක් නිර්මාණය වූ,f
04858a3a88,3eb66,කදුරුවෙල මහජන රැුස්වීමකදී මෙසේ පැවසූහ,f
0485d36db0,d78dd,යුද්ධයේ එක් පැත්තක් පමණි,m
0485f080bf,c28da,සමස්ථ මුස්ලිම් ජනයාගේ හඬ බවට පත්විය,m
048617193f,45feb,එය ධර්ම දානයට අයිති වෙනවා,m
048737afcf,3489d,ඔබේ පෞද්ගලික අත්දැකීම්,m
04891bed89,70278,මුව ගහනය දරන්න බැරි ගානට එන්නෙ නැතුව පාලනය උනා,f
048930fa9b,a3a6a,පාසල ද,f
0489df6353,8b8a4,දෙස් විදෙස්හි ශාස්ත්‍රීය ග්‍රන්ථයන්හි පළ වී ඇත,m
048a8a75be,dabc0,ඒව කියල දීල තියෙන්න එපායැ තේරෙන්න,m
048a95bb8c,3fcd4,ඒ වෙත අද්දවා ගනිති,f
048ab7dddf,47746,මෙසේ දේශනා කර ඇත,f
048ac041a7,96564,ඔයා කියන්න වගේ මේවා,m
048ace639b,290a8,උද්ඝෝෂණයේ නිරත වූ අයුරු ඡායාරූපයේ දැක්වේ,m
048b77e797,346c1,මෙතන ඇරෙන්න චිත්‍රපටය ගැන,f
048bfe4f72,53c73,ඇගේ කඳුළු කැමරාවෙන් වසන් කළ නිසා ජනතාව දැක්කෙ නැහැ,m
048c0c2dfb,0b586,ඒත් ඔවුන් වෙනත් සත්තු,f
048c15271b,3eb66,පොලිසිය පසුබට වන්නේ නැහැ,f
048c9b199e,c6a4f,සරසවි ආචාර්ය මණ්ඩලයද,f
048d465b40,ed3e5,මොකද ඔතන තියෙන්නෙ,m
048da4a9f0,72f9d,ආණ්ඩුව අමාරුවේ දැමීමේ කුමන්ත්‍රණයක යෙදෙනවා,m
048dffd1be,a4315,අපි කතාව නිම කිරීමට පෙර,f
048e0f9d99,438c8,ඒත් හාමුදුරුවරු ඇවිත් ආවේගාත්මකව හැසිරිලා,m
048e4b5436,40381,තමන් විප්ලවාදීන් යැයි කියාගත් අමනයන්,m
048ea54cb1,c8784,සංකල්පීය වශයෙන්,f
048f0a753d,71b3e,පුද පූජා කරන්න පටන් අරන් තියනවා,f
048f16231a,8eb5c,බුදුදහම නිර්දේශ කරනු ලබන්නේ,m
048f20b711,bafa0,එතකොට ආයිත් දවසක දැනගත්තොත්,f
048f436e94,44e28,ඇය ම මව වන්නී ය,f
048f503c70,d316f,අසරණ නිසාම ඉවසගෙන හිටියා,f
048f8263a0,ee9b8,එංගලන්තය එරෙහිව ලන්ඩන් ඕවල් ක්‍රීඩාංගණයේදී අද,m
048fc2e153,78366,හැබැයි පැය විසි හතරෙදිම,m
04907d8e41,c5a59,ගදෙන් සුවඳ වෙන්කරගන්න දන්නවා,m
0490c830d7,b7163,ඒත් හැකි සෑම වෙලාවකදීම,f
049271755d,93c65,මේ පන්සලේ ඉස්කෝලෙ තියාගෙන,m
049289fd0b,dd6f8,මගෙන් කරන ලද ඉල්ලීමකට අනුවයි,m
049300f055,e61f1,විහාර භූමිය ඔස්සේ ඉන් පිටතට දිව ගොස් ඇත,f
04930d444e,6e111,එබැවින් සත්ව ලෝකයෙහි,m
04938f9a5b,45feb,දෛවය කර්මය මේ ඕනෙ දෙයක් ගැන,m
0493bd2713,7599b,මිනිස් දැක්මට ගෙන ඒම යි,m
04940a6ea5,bd2b2,උතුරට ඒක අවශ්‍ය නෑ,f
049433e340,0184c,එම කෘතියෙන් ආවේශය ලද,f
0494982462,c6f6b,බුදුරජාණන් වහන්සේගේ කාලේ දවසක්,f
0495473bb6,f71ec,කතාකරා කියල ඇතුලට දායිද,f
049643a2c2,f4f83,උතුරේ සිදුවිය නොහැකි ඇයි,f
0496629ec6,55ab9,මහජනතාව ආයෝජනය කල මුදලට,m
04972a2fe3,47746,විභවතාව පුද්ගල මනස තුළ,f
049731e5e8,1575e,ගුවන් නියමුවන් දෙදෙනා පිළිබඳව ද,f
049745b6a9,ba1f0,එතුමා හැම තැනම,f
049825088d,41947,ධනය මිල මුදල් හා තම ව්‍යාපාර වලින් වාසි සැලසේ,m
04984b0f2c,8eb5c,වතුර ලබාගන්න අවස්ථාවක් නැති නිසා,m
04985729a1,3e0de,ස්කයිප් මඟින් ඵලාඵල සපයන එකම ජ්‍යෝතිෂ සේවය,f
0498ba4ade,3fcd4,හරියටම පාළු අහසක,f
04994d8d78,77b4b,පරක්කු වැඩියි,f
049a34853b,44978,දේශපාලනේ කියන්නෙ ඉගෙන ගත්තු අයට තැනක් නැති,m
049a77fd3a,fe011,ඉහළ විදුලි පාවිච්චියකට යන්නේ,m
049b1366bd,d316f,ඕක ටිකට් එක ගන්න කොටම ඒජන්ට් දෙනවා,f
049b5ad9bf,72b54,කූඩු බොහෝමයක් හිස්,f
049c2d6b57,2a845,පවුලෙ අයට මේල් යැවුවෙ,m
049c74bb7f,3b15d,හොඳට කතා කරනවා,f
049cb57f4e,b136f,අපි දුක ගැන දන්නවාන,f
049d6b995b,ed3e5,ඉහළම ගෞරවය වේවි,m
049db32d87,9f1f5,එහිදී ඔවුන් සඳහනක් කරනවා,m
049e89bc92,0b586,යක්ෂ භූත වැනි ආත්ම ලබන බවක්ද,f
049e9a8eb8,73ec9,හැබැයි ඒ දැනගෙන පරිස්සම් වුනානම්,f
049ec08b41,e9dcb,මහතා අදහස් දැක්වීය,m
049ee1cba5,30661,යෝග්‍ය ජාතක කථා රැසක් වේ,f
049f08ac00,c1691,ජීවන අරගලයේ ස්වභාවය පිළිබඳ,m
04a009838d,ee9b8,එම සිද්ධිය සිංහයකු මෙන් සිටි,m
04a01592b9,ad58a,ආරච්චි හා මැණිකේ විසින් පිළිගනු ලැබූහ,m
04a19009c4,3f57d,යටි රැවුල සම්පුර්ණයෙන්ම ගැලවිලා විසිවුණා නේද,m
04a26b71c6,b6388,රට රටවල රාජ්‍ය නායකයන්ට,m
04a2c6a103,ea3c6,අග්‍රගන්‍ය සේවයක්,m
04a4331175,349a2,පිරිතේ බලයෙන් ආරක්ෂාව ලබාදීමත්,f
