utterance_id,speaker_id,utterance,gender
0b815e3f90,4b215,මැටි කතාවක්,f
0b8191026f,c3bd0,කොලපාට මල්ගෝවා,f
0b81c66d2f,23e9e,ස්තූතියි සහෝ,f
0b81ee0279,ffa9f,ඔහු සතුව තියෙනවා,f
0b82919dd9,349a2,බුදුරජාණන් වහන්සේ වෙත පැමිණ මෙසේ කීවේය,f
0b838b497d,effa6,අසාර් කළාපයට අයිති අබා ප්‍රදේශය,m
0b83abecd0,58355,පරිපූර්ණත්වයට පත් කරලීමට නම්,m
0b83f1521a,cf7b2,දිගින් යුත් දියකඩනය සම්පූර්ණ කිරීම සඳහා,f
0b8401c594,da449,එය පිළිගන්නා නිසා නොව,f
0b843ec19d,9d5b3,මේ වකවානුව තුළ,f
0b845d6e54,39029,ඒක අහුවුණාම තමයි,m
0b8460fa80,bac38,පවුල් ජීවිතය සුන්ඳර ලෙස ගතකරන,f
0b846b6cc8,ffa9f,අල්ලන්න ඕනෙ,f
0b8471ea0b,78366,අධ්‍යාපනයේදී ඔවුන්ට ඒ අවශ්‍ය දැනුම ලැබෙනවා,m
0b84ff917d,7ba10,ගොවිපලක් සහ හේනක්,m
0b853ba053,c8454,සිදුවන දෙයක්,f
0b856152c9,2bc1e,ඔන්න මේක කිවුවාම,f
0b85631648,0a38f,දස වැන්න ද,f
0b863a95c4,b3dda,තුන් සියයකට අධික පිරිසක් මරණයට පත්වීමෙන් අනතුරුවයි,f
0b86bb075f,08a49,සේවා දිගුවක් දෙයි ද,f
0b86df2bec,6dcd3,සිරුරේ ප්‍රතිශක්තීකරණ පද්ධතිය,f
0b8743ae44,dabc0,ආචාර්ය ග්‍රැන්විල් ධර්මවර්ධන,m
0b874687ee,c28da,අපූර්වී තමයි වග කියන්න ඕන,m
0b8767f266,3eb66,ගිහින් නොසිතු විරු ප්‍රහාරයකට,f
0b88417d4c,8b124,අපි ගෙවන්නම්,f
0b888eb555,df981,කලාපීය බලතුලනය තමන්ට අවැසි ලෙස භාවිතා කිරීමට,m
0b88b3b902,53c73,ලොකු,m
0b88ead9b4,4b1d7,පෙලඹෙන අද දින සිතේ පැවැති බලාපොරොත්තුවක්,m
0b8ad53023,bb0e6,ආර්යයන් උතුම් ශ්‍රාවක පුද්ගල අට දෙනෙකි,f
0b8b2893fd,b8a97,එහෙම උත්සාහ නොකර,f
0b8b3fa223,c28da,ඊට මත්තෙන් ඇය,m
0b8b786703,225dc,ශ්‍රී සද්ධර්මය ඉතා යහපත් කොට වදාළ,m
0b8b923937,64af4,මේක හරියන්නේ නැති බව,m
0b8baf5ed3,937dc,අසරණ සතෙක්ව අහාරයට ගැනීම සදහා,f
0b8bd3f664,a6493,ලෝකයේ සංවර්ධනය වන රටවල ජනගහනයෙන් හයෙන් එකකට,f
0b8d1f8fdd,91fdf,අපිට අපේ ප්‍රශ්ණ වලට,f
0b8d3f84ac,e1e01,සුළු ජාතීන් සහ සුළු ආගමිකයන්ට,f
0b8d7fac95,349a2,තමන් දන්නවා යැයි සිතාගෙන කිය කියා යන්නෙකි,f
0b8e007f4c,42cde,වික්‍රමසිංහ විද්‍යාත්මක කරුණු ඇසුරින් පහදන්නේ,m
0b8ea83366,1afa7,සිහියෙන් වෙසෙද්දී මිය ගියහොත්,m
0b8ebf42e4,47746,ඊයේ දා කැබිතිගොල්ලෑව මහෙස්ත්‍රාත් අධිකරණයට ඉදිරිපත් කිරීමට නියමිතව තිබිණි,f
0b8f0fae4d,2d52b,දේශපාලනයට එන්න,f
0b8fb96e9e,acbee,අන්වීක්ෂයකින් බැලූ විට,m
0b90c63dc6,eae99,ඉදිරියට අපි බලමුකෝ නේද සහෝදරයා,m
0b9159d9bf,7424f,යන විෂයන් අතුරින් එකක් තෝරා ගැනීමට හැකියි,m
0b91c67b50,e8ec1,පෙම්වතෙක් මුණ ගැසී ඇත,m
0b91cff4b9,a624d,මහාචාර්ය සෙනරත් පරණවිතාන මහතා ද,m
0b91f4e443,746ff,ඔහු තුළ ඇතිවීම,f
0b924fd6d9,a4315,හරි දැන් බලමු,f
0b926e8870,30026,අන්න ඒකයි දිනුවත් පැරදුනත්,f
0b93b6d3da,34e11,වෑන් එකේ හරි එන කෙනෙක්,f
0b93d94b7f,60ae5,කතාබස් කරමින් සිටියේය,m
0b93f8defa,7ec98,අති විශිෂ්ටයි,f
0b9414f6f0,d7784,රැක ගැනීමට අප කාගේත් යුතුකමකි,f
0b9457e7e3,91403,අනිවා බාගෙනම බලනවා,m
0b948705c6,b796c,පූර්ව බ්‍රාහ්මී යුගයට අයත් ලිපි රැසක් ඇත,m
0b94d561be,c04d5,උන්ට කතිරේ ගහලා,f
0b95619b80,39cc4,ආයුර්වේද සූත්‍ර කමිටුව බෙහෙතක් අනුමත කරන පටිපාටිය කුමක්ද,f
0b961762f6,e9148,රන් කොත විකුණලා කියලා,m
0b965a2df4,0e353,ලෝකයේ පළමුවෙන් පූජනීයත්වයට පත් වූයේ,m
0b967b46f8,7f4b1,ගැන මොකද හිතන්නේ,f
0b96dffde4,225dc,එය වැරැදි ජීවන වෘත්තියක්,m
0b97f149fc,5c543,මහා සැනසිල්ලක් උදාවෙනවා,f
0b988c236c,156fe,වල් ඌරු කොත්තු දාගත්ත,f
0b98b82ed7,1575e,මනුෂ්‍ය නීතියත් අතර අරගල,f
0b98c355af,fb100,ලක් වූයේ ද,f
0b9a1e9328,3be3a,මඳ සිනාවෙන් යුතුව,m
0b9a40186a,bac38,ක්ෂේම භූමියක් වූ,f
0b9b8dc237,89f4f,මෙවැනි සිද්ධීන් නවතාලිය නොහැකියි,f
0b9bc18517,3e0de,සිංහල ජන ප්‍රවාද තුල,f
0b9c254971,501f8,ඒ මත ගොඩ නගා ඇති,f
0b9cbc3b2b,8b8a4,රිච්ට පරිමාණය කීයක විතර භූමිකම්පාද වෙන්නෙ,m
0b9cbf7700,2e893,පැමිණ බියගම විලේඡ් හෝටලයේ,m
0b9d5274d9,d2f72,එවැනි යානා ධාවනයට,m
0b9d651f6d,ff39f,අපි ස්වයංවිවේචනයක් සඳහා යා යුතු බවට,f
0b9da508b7,73ec9,තියෙන ලිපියක් නැද්ද,f
0b9dccabe5,b7163,මුඛය වටා වූ රැළි වලින් ගොළු බව නිරූපනය වේ,f
0b9dd0df6a,be485,ග්‍රාමීය ආර්ථිකය වර්ධනය වෙලා,f
0b9e285782,fd786,පැන නැගුන ගැටලු,f
0b9e2d9c01,85ebd,අද දැයට කිරුළ ප්‍රදර්ශන මට්ටමෙන් එහා ගොස්,f
0b9e77dd64,b1a64,ගුවන් අනතුරින් මිය ගිය අයගේ ඥාතීන්,f
0b9e831916,c26e2,ඒට පස්සේ එයා හදපු,f
0b9e9317df,30661,අවුරුදු ගානකට පස්සේ,f
0b9ebc7160,ddb8f,අපේ කණ්ඩායමේ අයට,f
0b9ef0d4fe,c6f6b,නගරවාසීන් තමන් වටා සිටින බවට ඔවුන් දැන සිටි බව,f
0b9f0923b3,32337,ඒත් වැදගත් අදහසක් නිසා,m
0b9f750187,a4315,හිතට දුකක් ඇතිවෙනවා,f
0ba0019753,b9dc2,ඇල්ෆා පිටත් වෙනවා,f
0ba0414804,f3204,මව් කුසින් බිහිවූ තැනැත්තා,f
0ba0ac0aca,202fc,භික්ෂු විනය තුළ,m
0ba13addf4,54242,සදාකාලිකව හද පත්ලේ ජීවමාන වේවි,f
0ba210677e,f32c3,සංඝීක දානයක් දිය යුතු හොඳම ක්‍රමය,f
0ba25dde85,c1715,මන්දාර්ව තමන්ගේ නාට්‍යයෙන්,m
0ba3099dde,03b7a,දුරකතන අංකයට කතාකර,m
0ba31ee4b5,c26e2,වටිනාකම පෙන්වා දෙන හොඳම සාධකයකි,f
0ba3ccc37e,0766f,රත්න ශ්‍රී යොදා ගන්නවා,f
0ba463423a,fda64,මම කිව්වේ,m
0ba516cc59,f3f41,එයින් විනය විනයඅභිවිනය වශයෙන්,f
0ba538d678,df38e,ඉකුත්වැනිදා අරැඹි මල් පෙරහරේ අවසන් දිනය,f
0ba56f2456,fc710,අවසාන වශයෙන් කිය යුත්තේ,f
0ba5c1d8e8,55c20,එතුමන්ව තිස් තුන් කෝටියක් දෙවියන් රකින්න ඕන,m
0ba5e83fae,0e1e0,සතුටු කළ හැක්කේ,f
0ba627fd9a,237d4,අකුණු වලට කියායි හිතෙන්නේ,f
0ba633e551,1c3b9,ඒත් අවාසනාවකට වගේ,m
0ba66fe6f0,1a1f3,ඒ ගැන නුවණින් විමසන්නේ නම් පමණි,m
0ba7f64141,df981,හැට දහසක් පමණ අතුරුදහන් වන අතර,m
0ba8e8cb66,f4f83,එම නවීන පහසුකම් ඇති කිරීමේදී,f
0ba91abe48,e9dcb,හලෝ කතන්දර,m
0ba97cc34d,5dec9,මේක තමා එහෙනන් අරක,m
0ba9b8136d,fa2d3,සිංහල බෞද්ධයෙනි අපට මගක් තියෙනවා,m
0baa176ca8,a3a6a,එය අනුරුද්ධ මහරහතන් වහන්සේට,f
0baa30bddb,1ccf9,සුවකර ගන්න බැරිකම නිසා ඇවිත් පැවිදි වෙනවා,m
0baa6d9de1,dc1f3,තුඹ නං මේ වෙනකොට,m
0baa75aed4,c1c21,මෙම ස්ථානය ප්‍රථමයෙන් කුහරේ ගල ලෙසද,f
0baabda231,1575e,ප්‍රධාන කාරණාව වෙන මේ චිත්‍රපටය,f
0baaecff70,1db0f,අපිත් මේවා කෑවා,f
0baaf8140e,25717,ගැලපීම සහ කතාවේ උන්නතියට ඇති බාධාව,m
0bab476000,6064f,අලෙවි වනු ඇතැයි,f
0babf2f362,f0a29,සැටලයිට් ඩිශ් එකක් භවිතා කරන්න,f
0baca1799b,7599b,ලොකු ගේමක් වෙනවා තව පැයක් දෙකක් යද්දී,m
0bad99ca3a,ff39f,ආගම මොකක් වුනත්,f
0badab6dd2,d4430,එකක් තමයි යම් දියුණුවක් ලබමින් තිබුන අපේ පොඩි පොඩි කර්මාන්ත වලට,m
0bae19f5bd,3dd78,අතිරික්ත වටිනාකම උරා ගැනීම,m
0bae5cde2f,f2931,මෙතන ලොකුම වරද තමයි වැරදි අච්චු ගසා බෙදා හැරීම,m
0bae9dc248,c4922,මොකද අමාත්‍යංශ දෙකක් අතර කටයුත්තකට තමයි,m
0baf6d95ba,338ff,බිහිවන මෙබඳු නිර්මාණ,m
0bb02d73d8,52af9,රජගහ නුවර වේළුවනාරාම පුණ්‍ය භූමිය මුල් කරගෙන,f
0bb065c941,ea3c6,නමුත් ආණ්ඩුව,m
0bb0a5c8fc,b9679,මම කොහෙද යන වල්බූරුවෙක්ගෙ යූ ටියුබ් රංගනයටත් ගාවනවා,m
0bb0de8458,bced5,සිංහල බ්ලොග් සාහිත්‍යය,m
0bb1074b5d,87c4c,තුලා රැකියා ව්‍යාපාර කටයුතු සම්බන්ධයෙන්,m
0bb1296c42,23e9e,ඒක නිසා අපි හැමතිස්සේම,f
0bb13fdc30,4b1d7,එමෙන් ම ඔහු කිසිදු අපරාධයක් කිරීමට,m
0bb1575c61,f32c3,මහා පිනක් කර ගන්නට මෙන්,f
0bb15d5db9,361fc,අන්න ඒ මිනිස්සුන්ගෙන් වත් උදාහරණයක් අරන්,m
0bb187ff12,e8724,සත්‍යාවබෝධය ලැබූ අසිරිමත් මිනිසා,m
0bb1f321b8,0e1e0,සුපුරුදු ආරාධනාව නැවතත් කරනවා,f
0bb21d9d1b,5a51f,එක තැනක තියනවා කියලා,f
0bb26c4d4b,b3dda,ඒ ඔවුන් මේ දරුවා සොයා ගොස්,f
0bb2eba046,ac581,පාඩුවක් සිදුවන බව පෙනී යයි,f
0bb2f7f27f,60906,ලාභ ප්‍රයෝජන අත්පත් වේ,f
0bb3433749,b6388,එතැනින් අම්පාරේ ඩිපෝවට මාරුවක් හදාගෙන ගියා,m
0bb3f06d2e,cf7b2,මේ විදියට ඓතිහාසික ශුද්ධ භූමි,f
0bb4e0be89,0224d,මුදල් ගෙවන අය,m
0bb502a4b2,53c73,බ්ලොග් ලියන්ට ගියාම,m
0bb54ee126,cd0b3,නුසුමනා මේ ප්‍රසංග වල,m
0bb5a9df75,0e353,දහදිය දැමීම ඉබේම සිදුවන්නකි,m
0bb5caa281,f200a,මගේ බැච් එකේ එවුන් කරලා එකෙකුට,m
0bb607655d,5a51f,බිත්තර ලැබෙන නිසා,f
0bb63ff773,4b1be,රැජිනිය අල්වා ගත්විට,f
0bb6afe35f,8e63d,ඉන්දියානුවන් වැඩි කලක් ජීවත් වීම,f
0bb6cba85c,a3d94,අපිත් ආවේ ඉන්දියාවෙන් නේ,m
0bb6d6a0b9,c4922,එහි වගකීම බාරදෙනු ලැබුව,m
0bb6e0e0db,646e1,එකම වස්තුව විනාශ වු විට,f
0bb7093955,1db0f,එවකට ආණ්ඩුවේ මුද්‍රණාලයේ අධිපතිව සිටි එච්,f
0bb752ca50,b9679,ඉතිහාසය යනු ප්‍රබන්ධයක් බව,m
0bb7a9499b,84afe,වරින් වර රජ පැමිණි,f
0bb7b3bf7e,f9563,එනම් සිංහල අර්ථය,m
0bb7b8afaf,be2e9,රුවන්වැලි සෑය ඉදිකරන ලද්දේ,f
0bb81055a1,3fcd4,අපි අද සඳැල්ල හැඩකර පිළිසඳරට එක්වෙමු,f
0bb81ce148,03500,හැම අවුරුද්දෙම,m
0bb8427f52,c2201,එක් එක් සත්ත්ව වර්ගයාට ආවේණික වූ,m
0bb88f8299,06d5c,ඔහුගේ ළමා කාලය හා බැඳී ගත් එකක් ද විය හැකිය,m
0bb93fbe80,be485,දකුණේ පීඩිතයාගේ සැබෑ මිතුරෙකි,f
0bb9979897,2ea36,මෙම රන්දෝලි පෙරහර ගමන් කරන අනුපිළිවෙලක් ද,f
0bba02a95a,462e8,හිටපු ජාතික පාසල් අධ්‍යක්ෂවරයකුගේ අත්සනක්,f
0bba9e669b,23c9f,ඇනෝලා කරන්නේ අති විශාල,m
0bbaf652d0,f4f83,බුද්ධාගමත් අදහනව,f
0bbaf78257,72f9d,මේ විදිහට මම මැරෙනකොට,m
0bbafe4525,55ab9,අතීතයේ කවද හරි දවසක,m
0bbb004a3b,1913e,මොකද කෙනෙකුට එතෙක් නොලැබි ප්‍රසිද්ධියක් ලැබුණාම,f
0bbbd8139a,b3a0c,සමහර මෘදුකාංග ස්ථාපනය අසීරු වීමත් නිසා,f
0bbc1c8988,6e111,වහාම මහාචාර්ය කෑල්ල භාවිතය ද අත්හළ යුතුය,m
0bbc722b65,7e3d4,මේ යුවළට දරුවන් නැහැ,m
0bbe2e172a,5a4cf,ජයමංගල ගාථා ලියා ඇති වෘත්තය,f
0bbe7639cc,a360d,නමුත් කවුරුන් හෝ මස් කෑමට අකමැති නම්,m
0bbf08773c,9094b,අප හට ගන්නවා ඇත,f
0bbf0a296a,d52f0,අහුබුදු ගෝලයගෙ එම ඓතිහාසික පරීක්ෂණය,f
0bbf13b77d,b3dda,මේ ආයතන වල සේවය කරන,f
0bbf7c986f,6064f,ඊට පස්සේ තමා හොඳ හරිය එන්නේ,f
0bbfaeb35c,3489d,එය විවෘත යමක්,m
0bc046fc4f,c094f,එයා අපි ඉස්සරහා,m
0bc09b4c61,ed4c3,මෙලෙස මනුෂ්‍යයෝ පමණක් නොව,f
0bc1930b16,be843,ඔය සන්නිවේදන කුළුණු වලින්,m
0bc270b40d,f0a29,මේ නිසාම භික්ෂූන් වහන්සේ,f
0bc2dc3c99,655f4,මතක නෑ සමහර විට,m
0bc3772d2c,11528,භික්ෂූ ආකල්පයන්ගෙන් යුක්ත,f
0bc39e62df,f40d9,කොතෙකුත් හමු විය හැකියි,m
0bc3c0631f,309ce,ස්ථානවල තිබෙන පුවරු,m
0bc45bb985,0e353,තේ ගස් සිටවූ ඉහළ කඳුකරයේ,m
0bc468aa45,52af9,අහන්න ලැබිලා ඒක අකුසල් කියලා,f
0bc49dff8c,ac562,ප්‍රංශ බසින් පළවූ මෙම කතා මාලාව,m
0bc4b948e6,44e28,ස්වයං නියාමනය පිලිබඳ බලවත් කනස්සල්ල,f
0bc54133a6,a360d,ඊට අමතරව අධ්‍යාපන රාජ්‍ය සේවා කොමිසම,m
0bc5f72b87,045af,අවාරයට හසු වෙන කාලය තමයි,f
0bc63405f9,a7c07,මෙලෙස ලංකාවට පැමිණීම සඳහා,m
0bc63421ba,357e6,දරන උත්සාහය හඳුනාගත හැකිය,f
0bc68ba61f,5dec9,අතෘප්තිමත් ඌරෙකුට වඩා තෘප්තිමත් ඌරෙක් හොඳ ද,m
0bc69d1a54,4b127,හිතට අරමුණු හිතුණා කියලා,m
0bc7b42027,b3dda,සීසර්ගෙන් බලය අල්ලගන්න හිතන,f
0bc7be00b0,5a51f,කතරගමට එකතු වූයේ,f
0bc806ffc7,3b15d,විය ගස සහ නගුල,f
0bc88dee05,1c3b9,එවකට පැවැති නුවරඑළියමස්කෙළිය බහු ආසනය තුළ,m
0bc894d08c,3e0de,කෙලෙස් බන්ධන වලින් නිදහස් වෙනවා,f
0bc8e9a430,a3fac,මානව ගරුත්වයට අදාළව ද,f
0bc9bc8587,b3777,අලගල්ලේ සිට කඩුගන්නාව මාර්ගයයි,m
0bca58eb05,40e62,ඉතිං මං කෙරුවේ,f
0bcb39e3a2,f4f83,ඔබේ පුද්ගලික විස්තර,f
0bcb3e541e,b136f,ඒ මල ජිවිතේ වගේ තමයි,f
0bcb95c821,e47dc,මේ දේශනා කරන ධර්මයේ,m
0bcc00370b,cd0b3,හොඳින් කිහිප විටක් කියවන්න,m
0bcc0d0ef0,409ee,කැපී පෙනිය හැකි අතර,m
0bcc0e2ce0,6e111,නමුත් ඒකා ප්‍රතිපත්තිමය කඩේ යෑමක් කරන්නේ,m
0bcc46d4aa,a6a62,මාත් බාන්න දැම්මා,m
0bcc88d03e,b9dc2,තවත් මේ වගේ වටින වැඩසටහන් දෙනවා නම්,f
0bcd008883,42cde,නමුත් ඒ ගැන,m
0bcd06d550,f3f41,එහි කියන දේවල් බොහොමයක්,f
0bcd879f24,ffa9f,දකුණේ යාල වනෝද්‍යානය භාරකරුව සිටි මා,f
0bcde11160,c04d5,හොඳ ජොලිය තමා ගන්නවා,f
0bcdf3383c,2e800,සියයට හතළිහත් හැටත් අතර පිරිසක්,f
0bce10ce4a,fd786,මනා වැටහීමක් ලබා ගන්න ඕනෙ,f
0bce5aebae,94b34,සෘජුවම මූල්‍ය වාසි නැතත්,f
0bce880c8d,b7163,පෞරුෂත්ව වර්ධනය කිරීමේ පාඨමාලා පවා ආරම්භ වුණා,f
0bce9f5dcc,13abb,හැමෝටම ඒක සපුරාම වලංගුයි,f
0bcee5c440,95423,ස්තුතියි දිදුල,f
0bcf4fda5a,e61f1,හරි දැන් ඒ කතාව නවත්තලා,f
0bcf5db9ae,60ae5,පොලිසිය කියයි,m
0bcf6b3811,7f4b1,මේ කොළඹට,f
0bd0a62e96,54c3a,අද පමණක් පස්ස ආසනයේ වාඩි ගන්නා ලෙස,f
0bd0f2ad58,778ef,දෙහිඅත්තකන්ඩියේ දුෂ්කර පාසලක ශාලාවක් සෑදීම,m
0bd115b06a,2e076,පෙරදිග වේද ප්‍රතිකාර ගැනීමට තරම්,f
0bd24136b8,10824,දුවන්න ගිහින් මළාලු,f
0bd31b1696,bac38,අපේ රටේ ජනවාර්ගික අර්බූදයට මූලිකව වග කිව යුතු පුද්ගලයා,f
0bd3a4de61,ab81c,හොලිවුඩය ආක්‍රමණය කරන්නත් සූදානමින් ඉන්නේ,f
0bd3c69fd6,7b332,ඌරු කිරි බිව්වම ඌරො වගේ හැසිරෙනව,m
0bd3cb687c,1c3b9,ලංකාවේ කවුරුත් කරල නෑ,m
0bd405b0d1,1b014,අවම වශයෙන් යම් බලයක් සහිතව,m
0bd4f712de,466d8,මගේ රට යැයි අපි සැවොම කියමු,f
0bd5297d77,8957e,නිරන්තර රෝගාබාධයන්ට ගොදුරු වෙති,m
0bd56fd777,0e353,මං මේ දන්නෙ නැති හංදා අහන්නේ,m
0bd5eab8d5,02b89,එය නැවත මතුපිට භාෂාත්මක ව්‍යුහය,m
0bd6888da7,39cc4,ඊට අප අනුගත වීමෙන්,f
0bd69da02e,409ee,මට උපසිරැසි එක්ක දෙන්න ලැබුනා,m
0bd70d0f58,21459,එතුමාට වන්දනා කරන්න කියලා,f
0bd72cd84b,c094f,ඔබභාවිතා කරන්නේ නම්,m
0bd7382697,6b5e6,නිදහස් වෙන්න හැකි රටකටද,m
0bd7c30622,3e0de,එවිය හැකි බව මතක් කර සිටිමි,f
0bd8542e82,4f068,තව පොඩ්ඩෙන් කොල්ලා එලොව යනවා,f
0bd94b444e,0b370,ඒක කරන්න,m
0bd99eac3f,cd0b3,නමුත් මේ රජය සමග ඇතිකරගත් සම්බන්ධතාව,m
0bd9a56a92,a7c07,උඹේ චොයිස් එකක් තෝර ගනිං,m
0bda5a866d,045af,සාම සාකච්ඡාවකට එළැඹි ඇය,f
0bda624f5f,a624d,බොහොම ස්තූතියි සමීර සහෝ,m
0bda6cd3f0,a4315,සසර ස්වභාව වටහාගත යුතු ස්ථානයෙකි,f
0bdb3f3826,d78dd,හරියට නිකන්,m
0bdc0c029c,4f068,බුද්ධාගම වැළඳ ගත් බව,f
0bdcb94a9e,3b15d,එතුමා මල්වතු මහා විහාරයට ඥාතිකමක්ද තිබෙනවා,f
0bdcc6655b,e6e7b,නමුත් දැන් ඒ බව,f
0bdcdf3819,73ec9,නොහැකි වූයේ නම් ඉතා ප්‍රබල,f
0bdd113089,dabc0,ඉන්ඩ වෙන්නෙ,m
0bdd73a843,e0b70,අදම ශිව රාත්‍රිය වශයෙනි,f
0bdd8deedd,64af4,මීමුරේ සවාරියක් දෙන්නෙමු,m
0bdde20f1d,45f15,රැකියා ස්ථානයේ උද්ගතවූ අවුල් සහගත තත්ත්වය,f
0bddfd5c29,11742,දෙවියන්ට පින්පෙත් අනුමෝදන් කොට,m
0bdece08d6,d9b9c,අනෙක් අතට ෆොන්සේකා මහතා මූලිකව,f
0bdedf598e,3139c,වැඩිහිටි උපදෙස් පිළිපැදිය යුතුය,f
0bdfcabf82,dabc0,ඒකෙ සුන්බුන් කැලණි ගඟට වැටිලා,m
0be182263a,d6ab0,ඉතින් ඇත්තටම එකක් තමයි,f
0be192afd0,c26ed,ගුණ අගුණ,f
0be1bb739f,b3dda,එමඟින් බුදු රදුන්ට,f
0be1ffecb7,646e1,මේ වනෝද්‍යානය අපට නැතිවේවි,f
0be2759c11,babec,ඔබාමා මහතාට අවශ්‍ය වී තිබේ,m
0be27a86e4,03500,මහා උත්සවාකාරයෙන් හින්දුහු සමරති,m
0be27a9e0c,95589,මහ හයියෙන් බැණ බැණ,m
0be2b8bc81,016b5,අතිශය සංවේදී මෙන්ම විස්මයජනක එකක් වුණා,f
0be32bfaea,a7d05,මොනවා සිතා ගනීදැයි,f
0be32c8d4c,f2ef0,අප සහයෝගයෙන් කටයුතු කරනවා,f
0be35b10f2,76999,දේශපාලනික ප්‍රවෘත්තියකට විතරක් නෙමෙයි ක්‍රිකට්,m
0be3ba458d,c094f,එකක් දෙකක් ඇර,m
0be3f5a953,4f068,මේක වැරදි දෙයක් කියලා පිළිගත්තොත්,f
0be414965a,12204,භික්ෂූන් අතර අග තනතුර ලබා ගන්නට,f
0be4e344b5,501f8,යමක් ග්‍රහණය කළේ නම්,f
0be51a40f3,0b370,ඔහුට ඇනා පසුපස ඒම අත්හරින ලෙස,m
